Rank;Sourceid;Title;Type;Issn;Publisher;Open Access;Open Access Diamond;SJR;SJR Quartile;H index;Total Docs. (2024);Total Docs. (3years);Total Refs.;Total Citations (3years);Citable Docs. (3years);Citations / Doc. (2years);Ref. / Doc.;%Female;Overton;SDG;Country;Region;Publisher;Coverage;Categories;Areas
267;21101017116;"Journal of Advances in Information Technology";journal;"17982340";"Engineering and Technology Publishing";Yes;No;0,297;Q3;26;141;299;4811;883;299;2,75;34,12;30,91;0;43;United States;Northern America;"Engineering and Technology Publishing";"2019-2025";"Artificial Intelligence (Q3); Computer Networks and Communications (Q3); Computer Science Applications (Q3); Information Systems (Q3); Software (Q3)";"Computer Science"
268;19900193685;"International Journal of Knowledge-Based and Intelligent Engineering Systems";journal;"13272314, 18758827";"SAGE Publications Ltd";No;No;0,295;Q3;25;29;96;1820;171;96;2,09;62,76;39,68;0;12;Netherlands;Western Europe;"SAGE Publications Ltd";"2004-2024";"Artificial Intelligence (Q3); Control and Systems Engineering (Q3); Software (Q3); Statistics and Probability (Q3); Statistics, Probability and Uncertainty (Q3)";"Computer Science; Decision Sciences; Engineering; Mathematics"
269;22679;"Jisuanji Jicheng Zhizao Xitong/Computer Integrated Manufacturing Systems, CIMS";journal;"10065911";"Computer Integrated Manufacturing Systems";No;No;0,295;Q3;42;356;1018;10700;1428;1018;1,33;30,06;32,72;0;97;China;Asiatic Region;"Computer Integrated Manufacturing Systems";"1996-2025";"Computer Science Applications (Q3); Control and Systems Engineering (Q3); Electrical and Electronic Engineering (Q3); Industrial and Manufacturing Engineering (Q3); Software (Q3)";"Computer Science; Engineering"
270;26131;"Jisuanji Xuebao/Chinese Journal of Computers";journal;"02544164";"Science Press";No;No;0,289;Q3;64;142;430;10710;880;430;1,63;75,42;28,82;0;14;China;Asiatic Region;"Science Press";"1998-2025";"Computer Graphics and Computer-Aided Design (Q3); Computer Networks and Communications (Q3); Hardware and Architecture (Q3); Software (Q3)";"Computer Science"
271;15012;"Acta Informatica";journal;"14320525, 00015903";"Springer New York";No;No;0,280;Q3;44;21;73;572;57;70;0,64;27,24;21,67;0;0;Germany;Western Europe;"Springer New York";"1971-2025";"Computer Networks and Communications (Q3); Information Systems (Q3); Software (Q3)";"Computer Science"
272;25547;"Interacting with Computers";journal;"18737951, 09535438";"Oxford University Press";No;No;0,280;Q3;97;30;110;1788;186;108;1,36;59,60;41,24;0;5;United Kingdom;Western Europe;"Oxford University Press";"1989-2024";"Library and Information Sciences (Q2); Software (Q3); Human-Computer Interaction (Q4)";"Computer Science; Social Sciences"
273;14500154706;"International Journal of Computational Intelligence and Applications";journal;"14690268, 17575885";"World Scientific Publishing Co., Inc.";No;No;0,279;Q3;26;36;92;1242;180;91;2,22;34,50;32,43;0;5;Singapore;Asiatic Region;"World Scientific Publishing Co., Inc.";"2008-2025";"Computer Science Applications (Q3); Software (Q3); Theoretical Computer Science (Q4)";"Computer Science; Mathematics"
274;21100985663;"International Journal of Computer Network and Information Security";journal;"20749104, 20749090";"Modern Education and Computer Science Press";Yes;No;0,277;Q3;20;60;121;1736;238;121;2,11;28,93;21,52;0;7;China;Asiatic Region;"Modern Education and Computer Science Press";"2019-2025";"Applied Mathematics (Q3); Computer Networks and Communications (Q3); Computer Science Applications (Q3); Information Systems (Q3); Safety Research (Q3); Software (Q3)";"Computer Science; Mathematics; Social Sciences"
275;100147332;"International Journal of Parallel, Emergent and Distributed Systems";journal;"17445779, 17445760";"Taylor and Francis Ltd.";No;No;0,276;Q3;27;51;126;1670;150;124;1,17;32,75;16,08;0;8;United Kingdom;Western Europe;"Taylor and Francis Ltd.";"2005-2025";"Computer Networks and Communications (Q3); Software (Q3)";"Computer Science"
276;13581;"Journal of Database Management";journal;"15338010, 10638016";"IGI Global";No;No;0,276;Q3;37;13;59;954;96;59;1,26;73,38;38,46;0;0;United States;Northern America;"IGI Global";"2003-2025";"Hardware and Architecture (Q3); Information Systems (Q3); Software (Q3)";"Computer Science"
277;25507;"Informatica (Slovenia)";journal;"18543871, 03505596";"Slovene Society Informatika";Yes;No;0,275;Q3;40;342;383;9264;719;377;1,82;27,09;41,14;0;71;Slovenia;Eastern Europe;"Slovene Society Informatika";"1995-2025";"Artificial Intelligence (Q3); Computer Science Applications (Q3); Software (Q3); Theoretical Computer Science (Q4)";"Computer Science; Mathematics"
278;21100824667;"Image Processing On Line";journal;"21051232";"IPOL - Image Processing on Line";Yes;Yes;0,273;Q3;15;16;63;333;79;63;1,11;20,81;28,57;0;0;France;Western Europe;"IPOL - Image Processing on Line";"2017-2025";"Signal Processing (Q3); Software (Q3)";"Computer Science"
279;24310;"International Journal of Pattern Recognition and Artificial Intelligence";journal;"02180014, 17936381";"World Scientific Publishing Co. Pte Ltd";No;No;0,273;Q3;64;188;652;7177;911;650;1,50;38,18;38,87;0;24;Singapore;Asiatic Region;"World Scientific Publishing Co. Pte Ltd";"1995-2025";"Computer Vision and Pattern Recognition (Q3); Software (Q3); Artificial Intelligence (Q4)";"Computer Science"
280;21100875102;"Diagnostyka";journal;"24495220, 16416414";"Polish Society of Technical Diagnostics";Yes;No;0,272;Q3;19;59;155;1692;217;155;1,45;28,68;22,83;0;18;Poland;Eastern Europe;"Polish Society of Technical Diagnostics";"2013-2024";"Biomedical Engineering (Q3); Electrical and Electronic Engineering (Q3); Mechanical Engineering (Q3); Safety, Risk, Reliability and Quality (Q3); Signal Processing (Q3); Software (Q3)";"Computer Science; Engineering"
281;21101060452;"Vietnam Journal of Computer Science";journal;"21968896";"World Scientific";Yes;Yes;0,272;Q3;11;38;77;1409;127;77;2,02;37,08;25,66;0;6;Singapore;Asiatic Region;"World Scientific";"2019-2025";"Computational Theory and Mathematics (Q3); Computer Science (miscellaneous) (Q3); Computer Vision and Pattern Recognition (Q3); Information Systems (Q3); Software (Q3); Artificial Intelligence (Q4)";"Computer Science"
282;21101038702;"Radioelectronic and Computer Systems";journal;"26632012, 18144225";"National Aerospace University Kharkiv Aviation Institute";Yes;No;0,264;Q3;13;70;179;2112;273;179;1,76;30,17;24,30;0;18;Ukraine;Eastern Europe;"National Aerospace University Kharkiv Aviation Institute";"2019-2024";"Computer Graphics and Computer-Aided Design (Q3); Computer Networks and Communications (Q3); Electrical and Electronic Engineering (Q3); Hardware and Architecture (Q3); Information Systems (Q3); Software (Q3)";"Computer Science; Engineering"
283;19700186821;"International Journal of Web Based Communities";journal;"17418216, 14778394";"Inderscience Enterprises Ltd";No;No;0,262;Q3;28;25;64;498;80;64;1,13;19,92;46,67;0;0;United Kingdom;Western Europe;"Inderscience Enterprises Ltd";"2004-2024";"Communication (Q3); Computer Networks and Communications (Q3); Education (Q3); Software (Q3)";"Computer Science; Social Sciences"
284;12961;"Journal of Computer and Systems Sciences International";journal;"10642307, 15556530";"Pleiades Publishing";No;No;0,261;Q3;25;71;243;1561;123;243;0,54;21,99;24,80;0;1;United States;Northern America;"Pleiades Publishing";"1993-2024";"Applied Mathematics (Q3); Computer Networks and Communications (Q3); Computer Vision and Pattern Recognition (Q3); Control and Systems Engineering (Q3); Information Systems (Q3); Software (Q3); Theoretical Computer Science (Q4)";"Computer Science; Engineering; Mathematics"
285;28360;"Journal of Object Technology";journal;"16601769";"Journal of Object Technology";Yes;No;0,261;Q3;40;22;71;857;91;69;1,47;38,95;10,14;0;1;Switzerland;Western Europe;"Journal of Object Technology";"2002-2024";"Software (Q3)";"Computer Science"
286;25396;"Design Automation for Embedded Systems";journal;"15728080, 09295585";"Springer Netherlands";No;No;0,259;Q3;33;11;35;490;48;33;1,40;44,55;10,00;0;3;Netherlands;Western Europe;"Springer Netherlands";"1996-2003, 2005, 2007-2025";"Hardware and Architecture (Q3); Software (Q3)";"Computer Science"
287;12170;"Modeling, Identification and Control";journal;"03327353, 18901328";"Research Council of Norway";Yes;Yes;0,259;Q4;31;12;37;298;37;37;0,96;24,83;13,33;0;5;Norway;Western Europe;"Research Council of Norway";"1980-1989, 1996-2024";"Computer Science Applications (Q3); Control and Systems Engineering (Q3); Modeling and Simulation (Q3); Software (Q4)";"Computer Science; Engineering; Mathematics"
288;21100820619;"Periodica Polytechnica Electrical Engineering and Computer Science";journal;"20645279, 20645260";"Budapest University of Technology and Economics";Yes;No;0,258;Q4;19;40;119;1167;170;118;1,65;29,18;15,04;0;13;Hungary;Eastern Europe;"Budapest University of Technology and Economics";"2012-2025";"Computer Networks and Communications (Q3); Computer Science Applications (Q3); Electrical and Electronic Engineering (Q3); Information Systems (Q3); Signal Processing (Q3); Software (Q4)";"Computer Science; Engineering"
289;6100152804;"International Journal of Computational Science and Engineering";journal;"17427185, 17427193";"Inderscience Enterprises Ltd";No;No;0,256;Q4;29;63;182;2567;289;181;1,40;40,75;34,03;0;10;United Kingdom;Western Europe;"Inderscience Enterprises Ltd";"2005-2025";"Computational Mathematics (Q3); Hardware and Architecture (Q3); Computational Theory and Mathematics (Q4); Modeling and Simulation (Q4); Software (Q4)";"Computer Science; Mathematics"
290;12492;"Journal of Information Science and Engineering";journal;"10162364";"Institute of Information Science";No;No;0,256;Q4;43;82;242;2155;269;241;1,27;26,28;34,38;0;17;Taiwan;Asiatic Region;"Institute of Information Science";"1993-1994, 1996-2025";"Library and Information Sciences (Q2); Computational Theory and Mathematics (Q3); Hardware and Architecture (Q3); Human-Computer Interaction (Q4); Software (Q4)";"Computer Science; Social Sciences"
291;21101268228;"Sakarya University Journal of Computer and Information Sciences";journal;"26368129";"Sakarya University";Yes;Yes;0,254;Q4;5;42;56;1514;71;56;1,27;36,05;18,39;0;8;Turkey;Middle East;"Sakarya University";"2022-2024";"Computer Science (miscellaneous) (Q3); Decision Sciences (miscellaneous) (Q3); Software (Q4); Theoretical Computer Science (Q4)";"Computer Science; Decision Sciences; Mathematics"
292;24258;"Inteligencia Artificial";journal;"11373601";"Asociacion Espanola de Inteligencia Artificial";Yes;Yes;0,251;Q4;16;27;64;1032;110;64;1,75;38,22;33,87;0;6;Spain;Western Europe;"Asociacion Espanola de Inteligencia Artificial";"2004-2010, 2012-2025";"Artificial Intelligence (Q4); Software (Q4)";"Computer Science"
293;21100211724;"Intelligent Decision Technologies";journal;"18724981, 18758843";"SAGE Publications Ltd";No;No;0,250;Q4;20;204;206;6700;308;196;1,42;32,84;35,32;0;64;Netherlands;Western Europe;"SAGE Publications Ltd";"2007-2024";"Computer Vision and Pattern Recognition (Q3); Artificial Intelligence (Q4); Human-Computer Interaction (Q4); Software (Q4); Statistics and Probability (Q4); Statistics, Probability and Uncertainty (Q4)";"Computer Science; Decision Sciences; Mathematics"
294;23958;"Journal of Multiple-Valued Logic and Soft Computing";journal;"15423980";"Old City Publishing";No;No;0,247;Q4;30;63;131;2114;181;128;0,89;33,56;34,03;0;15;United States;Northern America;"Old City Publishing";"2003-2025";"Logic (Q4); Software (Q4); Theoretical Computer Science (Q4)";"Computer Science; Mathematics"
295;21100369411;"Bulletin of the South Ural State University, Series: Mathematical Modelling, Programming and Computer Software";journal;"20710216, 23080256";"South Ural State University";No;No;0,245;Q4;15;29;124;562;65;124;0,63;19,38;42,86;0;5;Russian Federation;Eastern Europe;"South Ural State University";"2014-2024";"Computational Mathematics (Q3); Computational Theory and Mathematics (Q4); Modeling and Simulation (Q4); Software (Q4)";"Computer Science; Mathematics"
296;18056;"Jiqiren/Robot";journal;"10020446";"Chinese Academy of Sciences";No;No;0,242;Q4;33;63;198;2537;327;198;1,74;40,27;29,55;0;8;China;Asiatic Region;"Chinese Academy of Sciences";"1998, 2001-2025";"Electrical and Electronic Engineering (Q3); Mechanical Engineering (Q3); Applied Mathematics (Q4); Artificial Intelligence (Q4); Modeling and Simulation (Q4); Software (Q4)";"Computer Science; Engineering; Mathematics"
297;19913;"Ruan Jian Xue Bao/Journal of Software";journal;"10009825";"Chinese Academy of Sciences";No;No;0,241;Q4;75;280;786;16273;1206;784;1,33;58,12;30,97;0;17;China;Asiatic Region;"Chinese Academy of Sciences";"1995-2025";"Software (Q4)";"Computer Science"
298;15109;"IEICE Transactions on Information and Systems";journal;"17451361, 09168532";"Maruzen Co., Ltd/Maruzen Kabushikikaisha";No;No;0,240;Q4;58;194;748;4842;687;713;0,96;24,96;25,61;0;12;Japan;Asiatic Region;"Maruzen Co., Ltd/Maruzen Kabushikikaisha";"1993-2025";"Computer Vision and Pattern Recognition (Q3); Electrical and Electronic Engineering (Q3); Artificial Intelligence (Q4); Hardware and Architecture (Q4); Software (Q4)";"Computer Science; Engineering"
299;17800156773;"International Journal of Innovative Computing and Applications";journal;"17516498, 1751648X";"Inderscience Enterprises Ltd";No;No;0,235;Q4;20;5;87;263;73;85;0,70;52,60;41,67;0;1;United Kingdom;Western Europe;"Inderscience Enterprises Ltd";"2007-2024";"Hardware and Architecture (Q4); Software (Q4); Theoretical Computer Science (Q4)";"Computer Science; Mathematics"
300;13012;"RAIRO - Theoretical Informatics and Applications";journal;"1290385X, 09883754";"EDP Sciences";No;No;0,234;Q4;33;19;34;350;18;32;0,67;18,42;24,39;0;0;France;Western Europe;"EDP Sciences";"1995-2025";"Computer Science Applications (Q4); Mathematics (miscellaneous) (Q4); Software (Q4)";"Computer Science; Mathematics"
301;26742;"Performance Evaluation Review";journal;"01635999";"Association for Computing Machinery (ACM)";No;No;0,233;Q4;87;111;359;955;237;344;0,53;8,60;21,01;1;10;United States;Northern America;"Association for Computing Machinery (ACM)";"1980, 1982, 1984, 1986-1989, 1994, 1996-2025";"Computer Networks and Communications (Q3); Hardware and Architecture (Q4); Software (Q4)";"Computer Science"
302;21100244604;"Scientific Visualization";journal;"20793537";"National Research Nuclear University "MEPhI"";No;No;0,232;Q4;13;56;168;1319;112;168;0,69;23,55;38,32;0;8;Russian Federation;Eastern Europe;"National Research Nuclear University "MEPhI"";"2013-2024";"Computer Vision and Pattern Recognition (Q4); Software (Q4)";"Computer Science"
303;21100203301;"Journal of Information Processing Systems";journal;"2092805X, 1976913X";"Korea Information Processing Society (KIPS)";No;No;0,231;Q4;34;70;227;1352;228;227;0,73;19,31;45,57;0;12;South Korea;Asiatic Region;"Korea Information Processing Society (KIPS)";"2012-2024";"Information Systems (Q3); Software (Q4)";"Computer Science"
304;21100198475;"Electronic Letters on Computer Vision and Image Analysis";journal;"15775097";"Universitat Autonoma de Barcelona";Yes;Yes;0,230;Q4;15;7;41;187;69;41;1,67;26,71;42,11;0;1;Spain;Western Europe;"Universitat Autonoma de Barcelona";"2011-2024";"Computer Vision and Pattern Recognition (Q4); Software (Q4)";"Computer Science"
305;25482;"International Journal of Robotics and Automation";journal;"19257090, 08268185";"Acta Press";No;No;0,229;Q4;30;52;189;1550;146;186;0,91;29,81;29,09;0;14;Canada;Northern America;"Acta Press";"1995-2025";"Electrical and Electronic Engineering (Q3); Mechanical Engineering (Q3); Artificial Intelligence (Q4); Control and Systems Engineering (Q4); Modeling and Simulation (Q4); Software (Q4)";"Computer Science; Engineering; Mathematics"
306;21101132923;"Internet Technology Letters";journal;"24761508";"John Wiley and Sons Inc";No;No;0,226;Q4;25;158;204;2449;282;128;1,58;15,50;34,70;1;37;United Kingdom;Western Europe;"John Wiley and Sons Inc";"2018-2025";"Computer Networks and Communications (Q3); Artificial Intelligence (Q4); Information Systems (Q4); Software (Q4)";"Computer Science"
307;21101085281;"Art, Science, and Engineering of Programming";journal;"24737321";"AOSA Inc.";No;No;0,223;Q4;11;4;54;248;42;54;0,79;62,00;0,00;0;0;United States;Northern America;"AOSA Inc.";"2017-2024";"Artificial Intelligence (Q4); Computational Theory and Mathematics (Q4); Modeling and Simulation (Q4); Software (Q4); Theoretical Computer Science (Q4)";"Computer Science; Mathematics"
308;21100902867;"Differencialnie Uravnenia i Protsesy Upravlenia";journal;"18172172";"Saint Petersburg State University";No;No;0,223;Q4;7;32;83;746;30;83;0,33;23,31;28,85;0;1;Russian Federation;Eastern Europe;"Saint Petersburg State University";"2019-2024";"Analysis (Q4); Applied Mathematics (Q4); Computer Science Applications (Q4); Control and Optimization (Q4); Information Systems (Q4); Software (Q4)";"Computer Science; Mathematics"
309;21100820054;"International Journal of Computing";journal;"17276209, 23125381";"Research Institute of Intelligent Computer Systems";Yes;No;0,223;Q4;22;72;164;2492;190;164;1,28;34,61;30,16;0;13;Ukraine;Eastern Europe;"Research Institute of Intelligent Computer Systems";"2016-2024";"Computer Networks and Communications (Q3); Computer Science (miscellaneous) (Q3); Hardware and Architecture (Q4); Information Systems (Q4); Software (Q4)";"Computer Science"
310;26714;"Jisuanji Yanjiu yu Fazhan/Computer Research and Development";journal;"10001239";"Science Press";No;No;0,223;Q4;47;207;588;10550;753;587;1,20;50,97;31,56;0;24;China;Asiatic Region;"Science Press";"1998, 2001-2025";"Computer Networks and Communications (Q3); Hardware and Architecture (Q4); Software (Q4)";"Computer Science"
311;5800173367;"IET Computers and Digital Techniques";journal;"1751861X, 17518601";"John Wiley and Sons Ltd";Yes;No;0,221;Q4;49;7;63;316;85;62;1,25;45,14;22,73;0;3;United Kingdom;Western Europe;"John Wiley and Sons Ltd";"2007-2024";"Electrical and Electronic Engineering (Q3); Hardware and Architecture (Q4); Software (Q4)";"Computer Science; Engineering"
312;19900195075;"International Journal of Communication Networks and Information Security";journal;"20760930, 2073607X";"UK Zhende Publishing Limited";Yes;No;0,221;Q4;28;0;142;0;267;142;2,38;0,00;0,00;0;0;United Kingdom;Western Europe;"UK Zhende Publishing Limited";"2009-2022";"Computer Networks and Communications (Q3); Software (Q4)";"Computer Science"
313;21101186203;"International Journal of Intelligent Engineering Informatics";journal;"17588715, 17588723";"Inderscience Publishers";No;No;0,221;Q4;6;25;39;1415;99;39;2,54;56,60;28,57;0;5;United Kingdom;Western Europe;"Inderscience Publishers";"2022-2025";"Artificial Intelligence (Q4); Computer Science Applications (Q4); Computer Vision and Pattern Recognition (Q4); Human-Computer Interaction (Q4); Signal Processing (Q4); Software (Q4)";"Computer Science"
314;21100201073;"Journal of Institute of Control, Robotics and Systems";journal;"19765622";"Institute of Control, Robotics and Systems";No;No;0,221;Q4;14;177;454;4026;335;439;0,82;22,75;21,12;0;32;South Korea;Asiatic Region;"Institute of Control, Robotics and Systems";"2008-2025";"Applied Mathematics (Q4); Control and Systems Engineering (Q4); Software (Q4)";"Computer Science; Engineering; Mathematics"
315;21100793172;"Informatika i ee Primeneniya";journal;"19922264, 23109912";"Federal Research Center "Computer Science and Control" of Russian Academy of Sciences";No;No;0,220;Q4;10;24;173;343;76;173;0,50;14,29;40,00;0;1;Russian Federation;Eastern Europe;"Federal Research Center "Computer Science and Control" of Russian Academy of Sciences";"2015-2024";"Computer Networks and Communications (Q3); Applied Mathematics (Q4); Computational Theory and Mathematics (Q4); Information Systems (Q4); Software (Q4)";"Computer Science; Mathematics"
316;19900191968;"Journal of Communications Software and Systems";journal;"18456421";"University of Split";Yes;No;0,219;Q4;20;34;105;1344;121;103;1,17;39,53;20,21;0;4;Croatia;Eastern Europe;"University of Split";"2006-2025";"Electrical and Electronic Engineering (Q3); Software (Q4)";"Computer Science; Engineering"
317;19266;"International Journal of Computer Applications in Technology";journal;"09528091";"Inderscience Enterprises Ltd";No;No;0,218;Q4;33;39;302;835;390;300;1,27;21,41;36,92;0;3;United Kingdom;Western Europe;"Inderscience Enterprises Ltd";"1976, 1988-2024";"Computer Networks and Communications (Q3); Electrical and Electronic Engineering (Q3); Industrial and Manufacturing Engineering (Q3); Computer Science Applications (Q4); Information Systems (Q4); Software (Q4)";"Computer Science; Engineering"
318;19700186847;"International Journal of Digital Crime and Forensics";journal;"19416210, 19416229";"IGI Global Publishing";No;No;0,217;Q4;18;7;57;171;74;57;1,44;24,43;23,53;0;0;United States;Northern America;"IGI Global Publishing";"2009-2024";"Software (Q4)";"Computer Science"
319;11900154399;"International Journal of Data Warehousing and Mining";journal;"15483924, 15483932";"IGI Publishing";No;No;0,215;Q4;26;17;78;544;117;78;1,53;32,00;25,00;0;5;United States;Northern America;"IGI Publishing";"2005-2024";"Hardware and Architecture (Q4); Software (Q4)";"Computer Science"
320;5800179613;"International Journal of Ad Hoc and Ubiquitous Computing";journal;"17438225, 17438233";"Inderscience Enterprises Ltd";No;No;0,214;Q4;27;59;182;1943;204;181;1,28;32,93;27,13;0;14;United Kingdom;Western Europe;"Inderscience Enterprises Ltd";"2005-2025";"Computer Networks and Communications (Q4); Hardware and Architecture (Q4); Software (Q4)";"Computer Science"
321;21101028597;"Ledger";journal;"23795980";"University Library System, University of Pittsburgh";Yes;Yes;0,214;Q4;10;9;18;350;20;14;0,89;38,89;17,65;0;1;United States;Northern America;"University Library System, University of Pittsburgh";"2019-2024";"Computer Science (miscellaneous) (Q3); Economics, Econometrics and Finance (miscellaneous) (Q3); Computer Science Applications (Q4); Software (Q4)";"Computer Science; Economics, Econometrics and Finance"
322;19869;"Programming and Computer Software";journal;"16083261, 03617688";"Pleiades Publishing";No;No;0,212;Q4;23;99;251;2802;175;249;0,61;28,30;22,77;0;9;United States;Northern America;"Pleiades Publishing";"1978-1992, 1996-2025";"Software (Q4)";"Computer Science"
323;21101044836;"Journal of Computer Science and Technology (Argentina)";journal;"16666046, 16666038";"Facultad de Informatica, Universidad Nacional de La Plata";Yes;Yes;0,210;Q4;6;18;51;576;59;48;1,03;32,00;22,22;0;4;Argentina;Latin America;"Facultad de Informatica, Universidad Nacional de La Plata";"2019-2024";"Artificial Intelligence (Q4); Computer Science Applications (Q4); Computer Science (miscellaneous) (Q4); Computer Vision and Pattern Recognition (Q4); Hardware and Architecture (Q4); Software (Q4)";"Computer Science"
324;13024;"Acta Cybernetica";journal;"0324721X";"University of Szeged, Institute of Informatics";Yes;No;0,207;Q4;19;29;55;721;30;52;0,39;24,86;13,21;0;2;Hungary;Eastern Europe;"University of Szeged, Institute of Informatics";"1990-2024";"Information Systems and Management (Q3); Computational Theory and Mathematics (Q4); Computer Science (miscellaneous) (Q4); Computer Vision and Pattern Recognition (Q4); Electrical and Electronic Engineering (Q4); Management Science and Operations Research (Q4); Software (Q4); Theoretical Computer Science (Q4)";"Computer Science; Decision Sciences; Engineering; Mathematics"
325;18936;"IEICE Transactions on Communications";journal;"09168516, 17451345";"Maruzen Co., Ltd/Maruzen Kabushikikaisha";No;No;0,207;Q4;60;98;479;2935;343;462;0,66;29,95;16,33;0;10;Japan;Asiatic Region;"Maruzen Co., Ltd/Maruzen Kabushikikaisha";"1993-2025";"Computer Networks and Communications (Q4); Electrical and Electronic Engineering (Q4); Software (Q4)";"Computer Science; Engineering"
326;19270;"International Journal of Software Engineering and Knowledge Engineering";journal;"17936403, 02181940";"World Scientific Publishing Co. Pte Ltd";No;No;0,206;Q4;43;78;220;3209;208;213;0,99;41,14;32,77;0;3;Singapore;Asiatic Region;"World Scientific Publishing Co. Pte Ltd";"1996-2025";"Computer Graphics and Computer-Aided Design (Q3); Artificial Intelligence (Q4); Computer Networks and Communications (Q4); Software (Q4)";"Computer Science"
327;19400156805;"International Journal of Information and Computer Security";journal;"17441765, 17441773";"Inderscience Enterprises Ltd";No;No;0,204;Q4;19;49;194;1912;178;192;1,01;39,02;31,62;0;3;United Kingdom;Western Europe;"Inderscience Enterprises Ltd";"2007-2024";"Computer Networks and Communications (Q4); Hardware and Architecture (Q4); Safety, Risk, Reliability and Quality (Q4); Software (Q4)";"Computer Science; Engineering"
328;11700154336;"Journal of Computer Science";journal;"15493636";"Science Publications";Yes;No;0,200;Q4;38;157;318;5672;348;318;0,94;36,13;36,53;0;46;United States;Northern America;"Science Publications";"2008-2025";"Artificial Intelligence (Q4); Computer Networks and Communications (Q4); Software (Q4)";"Computer Science"
329;19700186849;"International Journal of Ambient Computing and Intelligence";journal;"19416245, 19416237";"IGI Global Publishing";No;No;0,197;Q4;27;9;74;243;89;74;1,24;27,00;50,00;0;5;United States;Northern America;"IGI Global Publishing";"2009-2014, 2016-2024";"Software (Q4)";"Computer Science"
330;21100223313;"Journal of Information Hiding and Multimedia Signal Processing";journal;"20734239, 20734212";"Taiwan Ubiquitous Information";No;No;0,197;Q4;31;22;59;678;53;58;1,00;30,82;37,25;0;3;Taiwan;Asiatic Region;"Taiwan Ubiquitous Information";"2010-2024";"Computer Vision and Pattern Recognition (Q4); Software (Q4)";"Computer Science"
