Rank;Sourceid;Title;Type;Issn;Publisher;Open Access;Open Access Diamond;SJR;SJR Quartile;H index;Total Docs. (2024);Total Docs. (3years);Total Refs.;Total Citations (3years);Citable Docs. (3years);Citations / Doc. (2years);Ref. / Doc.;%Female;Overton;SDG;Country;Region;Publisher;Coverage;Categories;Areas
1;19300156903;"Foundations and Trends in Machine Learning";journal;"19358245, 19358237";"Now Publishers Inc";No;No;22,797;Q1;42;5;12;1326;1613;12;48,33;265,20;25,00;1;0;United States;Northern America;"Now Publishers Inc";"2008-2024";"Artificial Intelligence (Q1); Human-Computer Interaction (Q1); Software (Q1)";"Computer Science"
2;21101007236;"Nature Machine Intelligence";journal;"25225839";"Springer International Publishing";Yes;No;5,876;Q1;94;177;484;9104;9769;353;18,44;51,44;27,87;2;20;Switzerland;Western Europe;"Springer International Publishing";"2019-2025";"Artificial Intelligence (Q1); Computer Networks and Communications (Q1); Computer Vision and Pattern Recognition (Q1); Human-Computer Interaction (Q1); Software (Q1)";"Computer Science"
3;21100274221;"IEEE Transactions on Cybernetics";journal;"21682275, 21682267";"IEEE Advancing Technology for Humanity";No;No;4,450;Q1;208;699;2284;33184;31927;2284;13,67;47,47;29,23;0;47;United States;Northern America;"IEEE Advancing Technology for Humanity";"2013-2025";"Computer Science Applications (Q1); Control and Systems Engineering (Q1); Electrical and Electronic Engineering (Q1); Human-Computer Interaction (Q1); Information Systems (Q1); Software (Q1)";"Computer Science; Engineering"
4;26099;"Information Fusion";journal;"18726305, 15662535";"Elsevier B.V.";No;No;4,128;Q1;179;510;670;37954;15732;660;22,65;74,42;29,47;2;86;Netherlands;Western Europe;"Elsevier B.V.";"2000-2025";"Hardware and Architecture (Q1); Information Systems (Q1); Signal Processing (Q1); Software (Q1)";"Computer Science"
5;24254;"IEEE Transactions on Pattern Analysis and Machine Intelligence";journal;"01628828";"IEEE Computer Society";No;No;3,910;Q1;435;812;2070;65710;47377;2059;21,19;80,92;27,12;0;15;United States;Northern America;"IEEE Computer Society";"1978-2025";"Applied Mathematics (Q1); Artificial Intelligence (Q1); Computational Theory and Mathematics (Q1); Computer Vision and Pattern Recognition (Q1); Software (Q1)";"Computer Science; Mathematics"
6;21100235616;"IEEE Transactions on Neural Networks and Learning Systems";journal;"2162237X, 21622388";"IEEE Computational Intelligence Society";No;No;3,686;Q1;269;1991;2021;97654;31905;2010;13,72;49,05;29,47;0;95;United States;Northern America;"IEEE Computational Intelligence Society";"2012-2025";"Artificial Intelligence (Q1); Computer Networks and Communications (Q1); Computer Science Applications (Q1); Software (Q1)";"Computer Science"
7;14966;"Journal of Manufacturing Systems";journal;"02786125";"Elsevier B.V.";No;No;3,633;Q1;120;246;662;15972;12977;653;17,62;64,93;23,95;0;129;Netherlands;Western Europe;"Elsevier B.V.";"1982-2025";"Control and Systems Engineering (Q1); Hardware and Architecture (Q1); Industrial and Manufacturing Engineering (Q1); Software (Q1)";"Computer Science; Engineering"
8;12321;"Information Systems Journal";journal;"13501917, 13652575";"Wiley-Blackwell Publishing Ltd";No;No;3,599;Q1;114;88;132;8367;1462;110;8,54;95,08;38,33;2;23;United Kingdom;Western Europe;"Wiley-Blackwell Publishing Ltd";"1991-2025";"Computer Networks and Communications (Q1); Information Systems (Q1); Software (Q1)";"Computer Science"
9;25037;"IEEE Transactions on Evolutionary Computation";journal;"1089778X";"Institute of Electrical and Electronics Engineers Inc.";No;No;3,495;Q1;222;257;364;9725;5263;357;12,51;37,84;27,27;0;21;United States;Northern America;"Institute of Electrical and Electronics Engineers Inc.";"1997-2025";"Computational Theory and Mathematics (Q1); Software (Q1); Theoretical Computer Science (Q1)";"Computer Science; Mathematics"
10;21100262320;"IEEE Transactions on Systems, Man, and Cybernetics: Systems";journal;"21682216, 21682232";"IEEE Advancing Technology for Humanity";No;No;3,254;Q1;184;672;2003;30273;22913;2003;10,82;45,05;30,41;0;67;United States;Northern America;"IEEE Advancing Technology for Humanity";"1996, 2011, 2013-2025";"Computer Science Applications (Q1); Control and Systems Engineering (Q1); Electrical and Electronic Engineering (Q1); Human-Computer Interaction (Q1); Information Systems (Q1); Software (Q1)";"Computer Science; Engineering"
11;21101101212;"AI Open";journal;"26666510";"KeAi Communications Co.";Yes;No;3,212;Q1;23;21;62;1049;1406;60;19,85;49,95;24,73;0;1;China;Asiatic Region;"KeAi Communications Co.";"2020-2025";"Artificial Intelligence (Q1); Computer Science Applications (Q1); Computer Vision and Pattern Recognition (Q1); Human-Computer Interaction (Q1); Information Systems (Q1); Software (Q1)";"Computer Science"
12;12137;"Journal of Statistical Software";journal;"15487660";"University of California at Los Angeles";Yes;Yes;3,211;Q1;187;39;145;2049;1310;144;8,11;52,54;21,14;2;2;United States;Northern America;"University of California at Los Angeles";"1996-2024";"Software (Q1); Statistics and Probability (Q1); Statistics, Probability and Uncertainty (Q1)";"Computer Science; Decision Sciences; Mathematics"
13;72242;"International Journal of Computer Vision";journal;"09205691, 15731405";"Springer Netherlands";No;No;3,136;Q1;232;373;486;29783;9156;476;12,79;79,85;27,85;0;13;Netherlands;Western Europe;"Springer Netherlands";"1987-2025";"Artificial Intelligence (Q1); Computer Vision and Pattern Recognition (Q1); Software (Q1)";"Computer Science"
14;18080;"Robotics and Computer-Integrated Manufacturing";journal;"07365845";"Elsevier Ltd";No;No;2,892;Q1;133;162;451;9287;6734;446;15,44;57,33;21,77;1;114;United Kingdom;Western Europe;"Elsevier Ltd";"1984-1994, 1996-2025";"Computer Science Applications (Q1); Control and Systems Engineering (Q1); Industrial and Manufacturing Engineering (Q1); Mathematics (miscellaneous) (Q1); Software (Q1)";"Computer Science; Engineering; Mathematics"
15;16733;"IEEE Transactions on Medical Imaging";journal;"02780062, 1558254X";"Institute of Electrical and Electronics Engineers Inc.";No;No;2,629;Q1;273;439;966;23203;11588;966;11,16;52,85;30,04;0;69;United States;Northern America;"Institute of Electrical and Electronics Engineers Inc.";"1982-2025";"Computer Science Applications (Q1); Electrical and Electronic Engineering (Q1); Radiological and Ultrasound Technology (Q1); Software (Q1)";"Computer Science; Engineering; Health Professions"
16;27239;"IEEE Network";journal;"08908044, 1558156X";"Institute of Electrical and Electronics Engineers Inc.";No;No;2,516;Q1;160;362;625;4853;5685;594;7,12;13,41;28,33;0;63;United States;Northern America;"Institute of Electrical and Electronics Engineers Inc.";"1986-2025";"Computer Networks and Communications (Q1); Hardware and Architecture (Q1); Information Systems (Q1); Software (Q1)";"Computer Science"
17;25534;"IEEE Transactions on Image Processing";journal;"10577149";"Institute of Electrical and Electronics Engineers Inc.";No;No;2,502;Q1;346;511;1750;32960;25095;1750;13,32;64,50;28,84;0;11;United States;Northern America;"Institute of Electrical and Electronics Engineers Inc.";"1992-2025";"Computer Graphics and Computer-Aided Design (Q1); Software (Q1)";"Computer Science"
18;27843;"Annual Reviews in Control";journal;"13675788";"Elsevier Ltd";No;No;2,386;Q1;111;40;173;4631;2070;163;11,58;115,78;20,63;0;6;United Kingdom;Western Europe;"Elsevier Ltd";"1996-2025";"Control and Systems Engineering (Q1); Software (Q1)";"Computer Science; Engineering"
19;18050;"International Journal of Robotics Research";journal;"02783649, 17413176";"SAGE Publications Inc.";No;No;2,333;Q1;202;150;189;10568;1937;171;7,50;70,45;18,83;0;21;United States;Northern America;"SAGE Publications Inc.";"1982-2025";"Applied Mathematics (Q1); Artificial Intelligence (Q1); Electrical and Electronic Engineering (Q1); Mechanical Engineering (Q1); Modeling and Simulation (Q1); Software (Q1)";"Computer Science; Engineering; Mathematics"
20;25038;"IEEE Transactions on Mobile Computing";journal;"15361233";"Institute of Electrical and Electronics Engineers Inc.";No;No;2,332;Q1;164;1135;1051;55842;10258;1051;9,72;49,20;30,32;0;165;United States;Northern America;"Institute of Electrical and Electronics Engineers Inc.";"2002-2025";"Computer Networks and Communications (Q1); Electrical and Electronic Engineering (Q1); Software (Q1)";"Computer Science; Engineering"
21;23127;"Journal of the ACM";journal;"00045411, 1557735X";"Association for Computing Machinery (ACM)";No;No;2,246;Q1;146;42;129;2671;557;121;3,31;63,60;14,50;0;0;United States;Northern America;"Association for Computing Machinery (ACM)";"1954-2025";"Artificial Intelligence (Q1); Control and Systems Engineering (Q1); Hardware and Architecture (Q1); Information Systems (Q1); Software (Q1)";"Computer Science; Engineering"
22;24207;"Fuzzy Optimization and Decision Making";journal;"15732908, 15684539";"Springer New York";No;No;2,171;Q1;68;28;76;808;594;76;7,87;28,86;32,31;0;7;United States;Northern America;"Springer New York";"2002-2025";"Artificial Intelligence (Q1); Logic (Q1); Software (Q1)";"Computer Science; Mathematics"
23;19700177034;"IEEE Transactions on Affective Computing";journal;"19493045";"Institute of Electrical and Electronics Engineers Inc.";No;No;2,136;Q1;103;270;500;16121;5560;492;11,09;59,71;34,66;0;16;United States;Northern America;"Institute of Electrical and Electronics Engineers Inc.";"2010-2025";"Human-Computer Interaction (Q1); Software (Q1)";"Computer Science"
24;24823;"Pattern Recognition";journal;"00313203";"Elsevier Ltd";No;No;2,058;Q1;257;851;1955;39457;19851;1953;9,84;46,37;30,40;0;31;United Kingdom;Western Europe;"Elsevier Ltd";"1968-2025";"Artificial Intelligence (Q1); Computer Vision and Pattern Recognition (Q1); Signal Processing (Q1); Software (Q1)";"Computer Science"
25;20969;"Journal of Machine Learning Research";journal;"15337928, 15324435";"Microtome Publishing";Yes;No;2,019;Q1;280;5;1035;396;8482;1035;6,74;79,20;16,67;0;0;United States;Northern America;"Microtome Publishing";"2001-2025";"Artificial Intelligence (Q1); Control and Systems Engineering (Q1); Software (Q1); Statistics and Probability (Q1)";"Computer Science; Engineering; Mathematics"
26;15572;"Information Systems Frontiers";journal;"15729419, 13873326";"Springer Netherlands";No;No;2,002;Q1;94;207;357;17356;4139;341;12,67;83,85;32,94;10;63;Netherlands;Western Europe;"Springer Netherlands";"1999-2025";"Computer Networks and Communications (Q1); Information Systems (Q1); Software (Q1); Theoretical Computer Science (Q1)";"Computer Science; Mathematics"
27;24772;"Knowledge-Based Systems";journal;"09507051";"Elsevier B.V.";No;No;1,934;Q1;188;1383;3015;77048;30317;3012;9,62;55,71;29,76;1;122;Netherlands;Western Europe;"Elsevier B.V.";"1987-2025";"Artificial Intelligence (Q1); Information Systems and Management (Q1); Management Information Systems (Q1); Software (Q1)";"Business, Management and Accounting; Computer Science; Decision Sciences"
28;15134;"Information Sciences";journal;"00200255";"Elsevier Inc.";No;No;1,803;Q1;243;1306;3981;57494;33358;3973;8,25;44,02;31,01;0;118;United States;Northern America;"Elsevier Inc.";"1968-2025";"Artificial Intelligence (Q1); Computer Science Applications (Q1); Control and Systems Engineering (Q1); Information Systems and Management (Q1); Software (Q1); Theoretical Computer Science (Q1)";"Computer Science; Decision Sciences; Engineering; Mathematics"
29;24363;"Journal of Intelligent Manufacturing";journal;"15728145, 09565515";"Springer Netherlands";No;No;1,763;Q1;113;397;462;23449;5049;458;10,94;59,07;24,90;1;197;Netherlands;Western Europe;"Springer Netherlands";"1990-2025";"Artificial Intelligence (Q1); Industrial and Manufacturing Engineering (Q1); Software (Q1)";"Computer Science; Engineering"
30;28512;"Mathematical Programming";journal;"14364646, 00255610";"Springer-Verlag GmbH and Co. KG";No;No;1,732;Q1;149;210;461;8529;1550;452;3,11;40,61;17,96;0;0;Germany;Western Europe;"Springer-Verlag GmbH and Co. KG";"1971-2025";"Mathematics (miscellaneous) (Q1); Software (Q1)";"Computer Science; Mathematics"
31;21100872828;"Foundations and Trends in Programming Languages";journal;"23251107, 23251131";"Now Publishers Inc";No;No;1,665;Q1;13;1;5;90;45;5;0,50;90,00;25,00;0;0;United States;Northern America;"Now Publishers Inc";"2014-2024";"Computer Science Applications (Q1); Software (Q1); Theoretical Computer Science (Q1)";"Computer Science; Mathematics"
32;12264;"Future Generation Computer Systems";journal;"0167739X";"Elsevier B.V.";No;No;1,551;Q1;180;481;1191;24998;11017;1161;8,95;51,97;24,20;2;98;Netherlands;Western Europe;"Elsevier B.V.";"1984-2025";"Computer Networks and Communications (Q1); Hardware and Architecture (Q1); Software (Q1)";"Computer Science"
33;21101079108;"ACM Transactions on Computing for Healthcare";journal;"26378051, 26911957";"Association for Computing Machinery (ACM)";No;No;1,548;Q1;22;25;108;1963;950;105;10,18;78,52;33,02;0;7;United States;Northern America;"Association for Computing Machinery (ACM)";"2020-2025";"Biomedical Engineering (Q1); Computer Science Applications (Q1); Health Informatics (Q1); Health Information Management (Q1); Information Systems (Q1); Medicine (miscellaneous) (Q1); Software (Q1)";"Computer Science; Engineering; Health Professions; Medicine"
34;18644;"Journal of Manufacturing Technology Management";journal;"1741038X";"Emerald Group Publishing Ltd.";No;No;1,532;Q1;100;88;218;6194;2198;215;8,66;70,39;31,32;0;67;United Kingdom;Western Europe;"Emerald Group Publishing Ltd.";"2004-2025";"Computer Science Applications (Q1); Control and Systems Engineering (Q1); Industrial and Manufacturing Engineering (Q1); Software (Q1); Strategy and Management (Q1)";"Business, Management and Accounting; Computer Science; Engineering"
35;21101058910;"Internet of Things (The Netherlands)";journal;"25426605";"Elsevier B.V.";No;No;1,527;Q1;69;423;592;26107;6589;586;11,45;61,72;20,30;4;189;Netherlands;Western Europe;"Elsevier B.V.";"2018-2025";"Artificial Intelligence (Q1); Computer Science Applications (Q1); Computer Science (miscellaneous) (Q1); Engineering (miscellaneous) (Q1); Hardware and Architecture (Q1); Information Systems (Q1); Management of Technology and Innovation (Q1); Software (Q1)";"Business, Management and Accounting; Computer Science; Engineering"
36;18136;"Applied Soft Computing";journal;"15684946";"Elsevier B.V.";No;No;1,511;Q1;208;1284;2987;73243;27020;2977;8,19;57,04;28,29;0;282;Netherlands;Western Europe;"Elsevier B.V.";"2001-2025";"Software (Q1)";"Computer Science"
37;23295;"Environmental Modelling and Software";journal;"18736726, 13648152";"Elsevier Ltd";No;No;1,466;Q1;178;246;684;16208;4046;683;5,20;65,89;25,66;3;127;United Kingdom;Western Europe;"Elsevier Ltd";"1997-2025";"Ecological Modeling (Q1); Environmental Engineering (Q1); Modeling and Simulation (Q1); Software (Q1)";"Computer Science; Environmental Science; Mathematics"
38;21101041418;"Computing and Software for Big Science";journal;"25102044";"Springer Nature";No;No;1,449;Q1;24;19;59;921;214;55;3,45;48,47;24,24;0;0;Switzerland;Western Europe;"Springer Nature";"2017-2025";"Computer Science (miscellaneous) (Q1); Nuclear and High Energy Physics (Q1); Software (Q1)";"Computer Science; Physics and Astronomy"
39;18711;"IEEE Transactions on Software Engineering";journal;"00985589";"Institute of Electrical and Electronics Engineers Inc.";No;No;1,447;Q1;193;186;721;13650;5302;721;6,78;73,39;26,90;0;12;United States;Northern America;"Institute of Electrical and Electronics Engineers Inc.";"1975-2025";"Software (Q1)";"Computer Science"
40;25040;"INFORMS Journal on Computing";journal;"10919856, 15265528";"INFORMS Institute for Operations Research and the Management Sciences";No;No;1,439;Q1;93;97;372;3953;1223;358;3,14;40,75;21,03;0;6;United States;Northern America;"INFORMS Institute for Operations Research and the Management Sciences";"1996-2001, 2003-2025";"Computer Science Applications (Q1); Information Systems (Q1); Management Science and Operations Research (Q1); Software (Q1)";"Computer Science; Decision Sciences"
41;27237;"IEEE/ACM Transactions on Networking";journal;"10636692";"Institute of Electrical and Electronics Engineers Inc.";No;No;1,394;Q1;187;423;623;21180;3474;623;5,02;50,07;26,48;0;28;United States;Northern America;"Institute of Electrical and Electronics Engineers Inc.";"1993-2024";"Computer Networks and Communications (Q1); Computer Science Applications (Q1); Electrical and Electronic Engineering (Q1); Software (Q1)";"Computer Science; Engineering"
42;12960;"International Journal of Human Computer Studies";journal;"10959300, 10715819";"Academic Press";No;No;1,394;Q1;152;129;323;10287;2874;321;6,96;79,74;36,60;0;14;United States;Northern America;"Academic Press";"1994-2025";"Education (Q1); Engineering (miscellaneous) (Q1); Hardware and Architecture (Q1); Human Factors and Ergonomics (Q1); Human-Computer Interaction (Q1); Software (Q1)";"Computer Science; Engineering; Social Sciences"
43;26422;"SIAM Journal on Optimization";journal;"10526234, 10957189";"Society for Industrial and Applied Mathematics Publications";No;No;1,388;Q1;152;136;349;6094;1031;349;2,32;44,81;19,57;0;1;United States;Northern America;"Society for Industrial and Applied Mathematics Publications";"1991, 1996-2025";"Applied Mathematics (Q1); Software (Q1); Theoretical Computer Science (Q1)";"Computer Science; Mathematics"
44;19400158592;"Mathematical Programming Computation";journal;"18672949, 18672957";"Springer Verlag";No;No;1,351;Q1;46;21;60;951;350;60;6,36;45,29;16,67;0;0;Germany;Western Europe;"Springer Verlag";"2009-2025";"Software (Q1); Theoretical Computer Science (Q1)";"Computer Science; Mathematics"
45;23490;"Journal of Scientific Computing";journal;"08857474, 15737691";"Springer New York";No;No;1,348;Q1;96;330;1001;14434;3209;1000;3,18;43,74;29,54;0;3;United States;Northern America;"Springer New York";"1986-2025";"Applied Mathematics (Q1); Computational Mathematics (Q1); Computational Theory and Mathematics (Q1); Engineering (miscellaneous) (Q1); Numerical Analysis (Q1); Software (Q1); Theoretical Computer Science (Q1)";"Computer Science; Engineering; Mathematics"
46;18661;"Structural and Multidisciplinary Optimization";journal;"16151488, 1615147X";"Springer Verlag";No;No;1,339;Q1;147;215;991;10917;4898;986;4,36;50,78;19,12;0;48;Germany;Western Europe;"Springer Verlag";"2000-2025";"Computer Graphics and Computer-Aided Design (Q1); Computer Science Applications (Q1); Control and Optimization (Q1); Control and Systems Engineering (Q1); Software (Q1)";"Computer Science; Engineering; Mathematics"
47;18121;"ACM Transactions on Software Engineering and Methodology";journal;"15577392, 1049331X";"Association for Computing Machinery (ACM)";No;No;1,283;Q1;91;188;342;15647;2365;339;6,51;83,23;28,79;1;7;United States;Northern America;"Association for Computing Machinery (ACM)";"1992-2025";"Software (Q1)";"Computer Science"
48;21100901150;"Data Science and Engineering";journal;"23641541, 23641185";"Springer International Publishing";Yes;Yes;1,273;Q1;32;33;86;1640;537;83;5,86;49,70;40,91;0;5;Switzerland;Western Europe;"Springer International Publishing";"2016-2025";"Artificial Intelligence (Q1); Computational Mechanics (Q1); Computer Science Applications (Q1); Information Systems (Q1); Software (Q1)";"Computer Science; Engineering"
49;21100338351;"IEEE Transactions on Cloud Computing";journal;"21687161";"Institute of Electrical and Electronics Engineers Inc.";No;No;1,254;Q1;72;124;603;5610;3527;600;5,95;45,24;27,27;0;7;United States;Northern America;"Institute of Electrical and Electronics Engineers Inc.";"2013-2025";"Computer Networks and Communications (Q1); Computer Science Applications (Q1); Hardware and Architecture (Q1); Information Systems (Q1); Software (Q1)";"Computer Science"
50;21100784665;"IEEE Transactions on Cognitive and Developmental Systems";journal;"23798920, 23798939";"Institute of Electrical and Electronics Engineers Inc.";No;No;1,249;Q1;62;227;435;11677;2589;426;5,48;51,44;28,01;0;22;United States;Northern America;"Institute of Electrical and Electronics Engineers Inc.";"2016-2025";"Artificial Intelligence (Q1); Software (Q1)";"Computer Science"
51;18120;"ACM Transactions on Mathematical Software";journal;"15577295, 00983500";"Association for Computing Machinery (ACM)";No;No;1,234;Q1;97;29;126;1164;456;126;3,38;40,14;16,87;0;0;United States;Northern America;"Association for Computing Machinery (ACM)";"1975-2024";"Applied Mathematics (Q1); Software (Q1)";"Computer Science; Mathematics"
52;12398;"Journal of Systems Architecture";journal;"13837621";"Elsevier B.V.";No;No;1,220;Q1;72;180;590;9826;3442;577;5,12;54,59;26,47;0;30;Netherlands;Western Europe;"Elsevier B.V.";"1996-2025";"Hardware and Architecture (Q1); Software (Q1)";"Computer Science"
53;26799;"Ad Hoc Networks";journal;"15708705";"Elsevier B.V.";No;No;1,210;Q1;115;238;488;11550;3430;482;6,74;48,53;27,13;0;69;Netherlands;Western Europe;"Elsevier B.V.";"2003-2025";"Computer Networks and Communications (Q1); Hardware and Architecture (Q1); Software (Q1)";"Computer Science"
54;144702;"Virtual Reality";journal;"13594338";"Springer London";Yes;No;1,198;Q1;73;170;417;11155;3142;416;6,51;65,62;34,45;0;26;United Kingdom;Western Europe;"Springer London";"1995, 1998-2000, 2002, 2004-2025";"Computer Graphics and Computer-Aided Design (Q1); Human-Computer Interaction (Q1); Software (Q1)";"Computer Science"
55;18079;"Robotics and Autonomous Systems";journal;"09218890";"Elsevier B.V.";No;No;1,168;Q1;148;187;485;9617;3305;482;6,87;51,43;19,95;0;41;Netherlands;Western Europe;"Elsevier B.V.";"1988-2025";"Computer Science Applications (Q1); Control and Systems Engineering (Q1); Mathematics (miscellaneous) (Q1); Software (Q1)";"Computer Science; Engineering; Mathematics"
56;25033;"IEEE Transactions on Computers";journal;"00189340";"IEEE Computer Society";No;No;1,156;Q1;145;257;709;10038;3256;702;4,42;39,06;26,05;0;23;United States;Northern America;"IEEE Computer Society";"1968-2025";"Computational Theory and Mathematics (Q1); Hardware and Architecture (Q1); Software (Q1); Theoretical Computer Science (Q1)";"Computer Science; Mathematics"
57;24775;"Machine Learning";journal;"15730565, 08856125";"Springer Netherlands";No;No;1,147;Q1;175;287;411;15391;2565;408;4,19;53,63;23,46;0;16;Netherlands;Western Europe;"Springer Netherlands";"1986-2025";"Artificial Intelligence (Q1); Software (Q1)";"Computer Science"
58;24303;"Computer Standards and Interfaces";journal;"09205489";"Elsevier B.V.";No;No;1,142;Q1;80;82;161;4085;1094;161;7,17;49,82;25,62;0;10;Netherlands;Western Europe;"Elsevier B.V.";"1986-2025";"Computer Science Applications (Q1); Hardware and Architecture (Q1); Law (Q1); Software (Q1)";"Computer Science; Social Sciences"
59;24305;"International Journal of Intelligent Systems";journal;"1098111X, 08848173";"John Wiley and Sons Inc";No;No;1,141;Q1;117;94;950;4974;5598;948;5,36;52,91;31,69;0;24;United Kingdom;Western Europe;"John Wiley and Sons Inc";"1986-2024";"Artificial Intelligence (Q1); Human-Computer Interaction (Q1); Software (Q1); Theoretical Computer Science (Q1)";"Computer Science; Mathematics"
60;23604;"Computer Methods and Programs in Biomedicine";journal;"01692607, 18727565";"Elsevier Ireland Ltd";No;No;1,130;Q1;150;484;1648;24147;10702;1641;6,09;49,89;32,50;1;158;Ireland;Western Europe;"Elsevier Ireland Ltd";"1985-2025";"Computer Science Applications (Q1); Health Informatics (Q1); Software (Q1)";"Computer Science; Medicine"
61;18089;"Advances in Engineering Software";journal;"18735339, 09659978";"Elsevier Ltd";No;No;1,124;Q1;107;141;351;7650;2554;350;7,58;54,26;21,11;0;23;United Kingdom;Western Europe;"Elsevier Ltd";"1982-1983, 1992-2025";"Engineering (miscellaneous) (Q1); Software (Q1)";"Computer Science; Engineering"
62;21101039775;"Machine Learning: Science and Technology";journal;"26322153";"Institute of Physics Publishing";Yes;No;1,119;Q1;41;319;412;18453;2483;412;4,97;57,85;21,48;2;23;United Kingdom;Western Europe;"Institute of Physics Publishing";"2020-2025";"Artificial Intelligence (Q1); Human-Computer Interaction (Q1); Software (Q1)";"Computer Science"
63;19700187627;"International Journal of Digital Earth";journal;"17538955, 17538947";"Taylor and Francis Ltd.";Yes;No;1,111;Q1;69;345;439;20101;2468;433;5,56;58,26;35,62;2;157;United Kingdom;Western Europe;"Taylor and Francis Ltd.";"2008-2025";"Computer Science Applications (Q1); Earth and Planetary Sciences (miscellaneous) (Q1); Software (Q1)";"Computer Science; Earth and Planetary Sciences"
64;18186;"Engineering with Computers";journal;"14355663, 01770667";"Springer London";No;No;1,110;Q1;93;253;974;14399;6774;968;6,81;56,91;19,31;0;22;United Kingdom;Western Europe;"Springer London";"1985-2025";"Computer Science Applications (Q1); Engineering (miscellaneous) (Q1); Modeling and Simulation (Q1); Software (Q1)";"Computer Science; Engineering; Mathematics"
65;24800;"Neural Computing and Applications";journal;"09410643, 14333058";"Springer London";No;No;1,102;Q1;146;1375;3832;72689;26087;3781;6,52;52,86;28,05;1;315;United Kingdom;Western Europe;"Springer London";"1993-2025";"Artificial Intelligence (Q1); Software (Q1)";"Computer Science"
66;144889;"Journal of Intelligent Transportation Systems: Technology, Planning, and Operations";journal;"15472450, 15472442";"Taylor and Francis Ltd.";No;No;1,065;Q1;64;106;147;4453;779;146;5,10;42,01;27,72;0;59;United Kingdom;Western Europe;"Taylor and Francis Ltd.";"2004-2025";"Aerospace Engineering (Q1); Applied Mathematics (Q1); Automotive Engineering (Q1); Computer Science Applications (Q1); Control and Systems Engineering (Q1); Information Systems (Q1); Software (Q1)";"Computer Science; Engineering; Mathematics"
